{
  "id": "CH-0005",
  "date": "2026-06-26",
  "author": "Vinayak Gautham",
  "type": "add",
  "object_type": "docs",
  "object_id": "GOVERNANCE.md",
  "summary": "Published the Repository Governance Charter. Defines the seven principles that govern all contributions: evidence before inference, deterministic computation before AI, every rule has legal authority, every decision is traceable, every rule is tested, every change is versioned, architecture changes require measurable justification. Includes release quality profile format and Phase 5 epic priorities.",
  "authority": null,
  "prior_version": "1.3.0",
  "new_version": "1.3.1",
  "git_commit": null,
  "notes": "The charter is a permanent document. It does not expire and is updated only by a Change record approved by the repository maintainer. This is the last document before Phase 5 (Knowledge Expansion) begins."
}
